{
  "id": "yagura_kinyagura_opponent",
  "name": "矢倉囲い(金矢倉)",
  "name_kana": "やぐらがこい(きんやぐら)",
  "side": "opponent",
  "family": "矢倉系",
  "parent_shape_id": null,
  "required_pieces": [
    {
      "piece": "玉",
      "square": "2b",
      "optional": false
    },
    {
      "piece": "金",
      "square": "3b",
      "optional": false
    },
    {
      "piece": "銀",
      "square": "3c",
      "optional": false
    },
    {
      "piece": "金",
      "square": "4c",
      "optional": false
    }
  ],
  "typical_build_order": [
    "3c",
    "3b",
    "2b",
    "4c"
  ],
  "characteristics": "相手がこの形に組んでいるかを読むためのレコードです。形そのものの意味は自分側の同じ名前の形(yagura_kinyagura)と同じで、盤の上では 180 度回った位置に現れます。飛車を右側(2筋)に置いたまま戦う居飛車で、玉を盤の左側(自分から見て左)へ移し、金2枚と銀1枚を玉の前に縦に並べて固める囲いです。相手の飛車が前に進んでくる筋(相手の飛車先)を金銀で受け止める形になっていて、上から攻められることに強いのが特徴です。組み上がるまでに動かす駒が多く、完成には手数がかかります。",
  "beginner_friendliness": {
    "score": 3,
    "reason": "**相手の陣形を読むためのレコードで、自分が組むための評価ではありません。** 点は自分側の同じ形(yagura_kinyagura)から写しただけの値です。"
  },
  "weak_against": "相手がこの形のとき、attackable な方向の目安です(断定ではありません)。上からの攻めには強い一方、横から(玉の横の段を通って)攻められることや、囲いの端(9筋・8筋の歩の上)を攻められることには弱さが残りやすいです。組み上がる前に速く攻められると、金銀が玉から離れたまま戦うことになります。",
  "source": "【AI起草。座標の一次資料確認は行っていない(docs/ROLES.md の保留事項)】**自分側の同じ形 yagura_kinyagura の座標を、盤ごと 180 度回して写したもの**(筋 f → 10−f、段 r → 10−r の両方を反転。写像: 玉2b・金3b・銀3c・金4c)。**出典そのものが後手の座標を述べているわけではない**(出典は自分側のレコードの source を参照)。過去に「段だけを反転させて左右が入れ替わる」取り違えが起きているため(docs/PHASES.md の P-12、docs/STEP_UNIT6_PLAN_2026-09-12.md §9.5 の決定 3)、**この 10 件は写像の式を source に書き、4 人 70 局の実棋譜で相手の陣形として実際に当たるか(完成した局の数)を測ってから記録した**。判定は後手視点で行われる(apps/server/src/analysis/shapeDetector.ts の perspectiveColorsForSide が side: opponent を gote に固定する)。 追加の経緯: 2026-09-25 の知識レーン第 7 組(docs/LANE_KNOWLEDGE_LOG_2026-09.md §9)。data/ に相手側の陣形(side: opponent)が 1 件も無く、4 人 70 局の 40 手目で相手玉が 8二(11 局)・3二(8 局)・7二(7 局)に多かったため。",
  "confidence_level": "medium",
  "review_status": "draft"
}
