{
  "id": "yagura_doi_opponent",
  "name": "土居矢倉",
  "name_kana": "どいやぐら",
  "side": "opponent",
  "family": "矢倉系",
  "parent_shape_id": null,
  "required_pieces": [
    {
      "piece": "玉",
      "square": "3b",
      "optional": false
    },
    {
      "piece": "金",
      "square": "4b",
      "optional": false
    },
    {
      "piece": "金",
      "square": "5b",
      "optional": false
    },
    {
      "piece": "銀",
      "square": "3c",
      "optional": false
    }
  ],
  "typical_build_order": [
    "3c",
    "4b",
    "5b",
    "3b"
  ],
  "characteristics": "相手がこの形に組んでいるかを読むためのレコードです。形そのものの意味は自分側の同じ名前の形(yagura_doi)と同じで、盤の上では 180 度回った位置に現れます。玉を7八に置き、金2枚を6八・5八に横に並べ、銀を7七に上げた矢倉です。片矢倉と同じく玉が7八にいますが、金が縦ではなく横に並ぶ点が違います。土居市太郎名誉名人の名前がついた形です。",
  "beginner_friendliness": {
    "score": 3,
    "reason": "**相手の陣形を読むためのレコードで、自分が組むための評価ではありません。** 点は自分側の同じ形(yagura_doi)から写しただけの値です。"
  },
  "weak_against": "相手がこの形のとき、attackable な方向の目安です(断定ではありません)。玉の左側(8筋・9筋)に守りの駒が無いため、そちらから攻められると受けにくいです。金2枚が横に並ぶので、上からの攻めに対しては縦の重なりがありません。",
  "source": "【AI起草。座標の一次資料確認は行っていない(docs/ROLES.md の保留事項)】**自分側の同じ形 yagura_doi の座標を、盤ごと 180 度回して写したもの**(筋 f → 10−f、段 r → 10−r の両方を反転。写像: 玉3b・金4b・金5b・銀3c)。**出典そのものが後手の座標を述べているわけではない**(出典は自分側のレコードの source を参照)。過去に「段だけを反転させて左右が入れ替わる」取り違えが起きているため(docs/PHASES.md の P-12、docs/STEP_UNIT6_PLAN_2026-09-12.md §9.5 の決定 3)、**写像の式をこの source に書き、4 人 70 局の実棋譜で相手の陣形として当たるかを測ってから記録した**。判定は後手視点で行われる(apps/server/src/analysis/shapeDetector.ts の perspectiveColorsForSide が side: opponent を gote に固定する)。 追加の経緯: 2026-09-25 の知識レーン第 16 組(docs/LANE_KNOWLEDGE_LOG_2026-09.md §19)。**相手側を目録の 35 件すべてまで写し切り、床(沈黙が動かなくなる点)を確かめるための最後の組**。人間の決定(2026-09-25、網羅)に沿って当たりにくい形も含めて写した。",
  "confidence_level": "medium",
  "review_status": "draft"
}
