{
  "id": "mino_ginkanmuri_opponent",
  "name": "銀冠",
  "name_kana": "ぎんかんむり",
  "side": "opponent",
  "family": "美濃系",
  "parent_shape_id": "mino_takamino_opponent",
  "required_pieces": [
    {
      "piece": "玉",
      "square": "8b",
      "optional": false
    },
    {
      "piece": "銀",
      "square": "8c",
      "optional": false
    },
    {
      "piece": "金",
      "square": "7b",
      "optional": false
    },
    {
      "piece": "金",
      "square": "6c",
      "optional": false
    },
    {
      "piece": "桂",
      "square": "7c",
      "optional": false
    }
  ],
  "typical_build_order": [
    "8b",
    "6c",
    "7c",
    "8c",
    "7b"
  ],
  "characteristics": "相手がこの形に組んでいるかを読むためのレコードです。形そのものの意味は自分側の同じ名前の形(mino_ginkanmuri)と同じで、盤の上では 180 度回った位置に現れます。高美濃囲いからさらに銀を玉の斜め上(2七)へ進め、空いたマスに金(4九にあった金)を寄せて発展させた形。銀が玉の近くまで上がることで冠のような形になり、上部からの攻めに非常に強くなる。",
  "beginner_friendliness": {
    "score": 2,
    "reason": "**相手の陣形を読むためのレコードで、自分が組むための評価ではありません。** 点は自分側の同じ形(mino_ginkanmuri)から写しただけの値です。"
  },
  "weak_against": "相手がこの形のとき、attackable な方向の目安です(断定ではありません)。上部からの攻めには強い一方、銀が守りの中心から離れるため、下段(玉の下側)や、完成までの間に横から速く攻められることには弱くなりやすいです。相手が急戦(棒銀・斜め棒銀・早仕掛けなど)を狙っている場面では、組み上げるタイミングに注意が必要です。",
  "source": "【AI起草。座標の一次資料確認は行っていない(docs/ROLES.md の保留事項)】**自分側の同じ形 mino_ginkanmuri の座標を、盤ごと 180 度回して写したもの**(筋 f → 10−f、段 r → 10−r の両方を反転。写像: 玉8b・銀8c・金7b・金6c・桂7c)。**出典そのものが後手の座標を述べているわけではない**(出典は自分側のレコードの source を参照)。過去に「段だけを反転させて左右が入れ替わる」取り違えが起きているため(docs/PHASES.md の P-12、docs/STEP_UNIT6_PLAN_2026-09-12.md §9.5 の決定 3)、**この 10 件は写像の式を source に書き、4 人 70 局の実棋譜で相手の陣形として実際に当たるか(完成した局の数)を測ってから記録した**。判定は後手視点で行われる(apps/server/src/analysis/shapeDetector.ts の perspectiveColorsForSide が side: opponent を gote に固定する)。 追加の経緯: 2026-09-25 の知識レーン第 7 組(docs/LANE_KNOWLEDGE_LOG_2026-09.md §9)。data/ に相手側の陣形(side: opponent)が 1 件も無く、4 人 70 局の 40 手目で相手玉が 8二(11 局)・3二(8 局)・7二(7 局)に多かったため。",
  "confidence_level": "low",
  "review_status": "draft"
}
