{
  "id": "mino_hayagakoi_opponent",
  "name": "振り飛車早囲い",
  "name_kana": "ふりびしゃはやがこい",
  "side": "opponent",
  "family": "美濃系",
  "parent_shape_id": null,
  "required_pieces": [
    {
      "piece": "玉",
      "square": "7b",
      "optional": false
    },
    {
      "piece": "銀",
      "square": "6b",
      "optional": false
    },
    {
      "piece": "金",
      "square": "6a",
      "optional": false
    }
  ],
  "typical_build_order": [
    "6b",
    "7b"
  ],
  "characteristics": "相手がこの形に組んでいるかを読むためのレコードです。形そのものの意味は自分側の同じ名前の形(mino_hayagakoi)と同じで、盤の上では 180 度回った位置に現れます。振り飛車で、玉を3八、銀を4八に置き、金4九はそのまま残した、数手でできる小さな囲いです。美濃囲いを組む手数が無いときの仮の形で、玉のとなりに銀がいるので横からの攻めを少しだけ受けられます。",
  "beginner_friendliness": {
    "score": 4,
    "reason": "**相手の陣形を読むためのレコードで、自分が組むための評価ではありません。** 点は自分側の同じ形(mino_hayagakoi)から写しただけの値です。"
  },
  "weak_against": "相手がこの形のとき、attackable な方向の目安です(断定ではありません)。駒が少なく玉が3八にいるため、上からの攻め(3七・2七)にも横からの攻めにも薄いです。長く戦うなら美濃囲いへ組み直す必要があります。",
  "source": "【AI起草。座標の一次資料確認は行っていない(docs/ROLES.md の保留事項)】**自分側の同じ形 mino_hayagakoi の座標を、盤ごと 180 度回して写したもの**(筋 f → 10−f、段 r → 10−r の両方を反転。写像: 玉7b・銀6b・金6a)。**出典そのものが後手の座標を述べているわけではない**(出典は自分側のレコードの source を参照)。過去に「段だけを反転させて左右が入れ替わる」取り違えが起きているため(docs/PHASES.md の P-12、docs/STEP_UNIT6_PLAN_2026-09-12.md §9.5 の決定 3)、**写像の式をこの source に書き、4 人 70 局の実棋譜で相手の陣形として当たるかを測ってから記録した**。判定は後手視点で行われる(apps/server/src/analysis/shapeDetector.ts の perspectiveColorsForSide が side: opponent を gote に固定する)。 追加の経緯: 2026-09-25 の知識レーン第 15 組(docs/LANE_KNOWLEDGE_LOG_2026-09.md §18)。第 7 組の相手側 10 件が効いた(30 手までで相手側の認識 0 → 365 局面)ため、同じ方法で残りを写した。",
  "confidence_level": "medium",
  "review_status": "draft"
}
