{
  "id": "mino_kimura",
  "name": "木村美濃",
  "name_kana": "きむらみの",
  "side": "self",
  "family": "美濃系",
  "parent_shape_id": "mino_katamino",
  "required_pieces": [
    {
      "piece": "玉",
      "square": "2h",
      "optional": false
    },
    {
      "piece": "金",
      "square": "3h",
      "optional": false
    },
    {
      "piece": "銀",
      "square": "4g",
      "optional": false
    }
  ],
  "typical_build_order": [
    "2h",
    "3h",
    "4g"
  ],
  "characteristics": "玉を2八に置き、その左に金(3八)、さらに斜め上に銀(4七)を置いた囲いです。片美濃の銀を一段前に出した形で、上からの攻めに少し強くなります。木村義雄が香落ち戦で多く使ったことからこの名前で呼ばれます。",
  "beginner_friendliness": {
    "score": 3,
    "reason": "駒は 3 枚で、片美濃から銀を 1 つ前に出すだけです。ただし玉のすぐ近くに駒が少ないので、王手がかかると逃げ道が限られます。"
  },
  "weak_against": "玉に紐(ひも。取られたときに取り返せる駒)が付いていないため、いったん王手がかかると受けにくい形です。出典は 3五歩からの攻めや、7九・6九へ角を打ち込む筋を崩し方として挙げています。",
  "source": "【AI起草。図から起こした / 出典は下記】Wikipedia『美濃囲い』(https://ja.wikipedia.org/wiki/美濃囲い (参照日 2026-09-25))の派生形の図と、同じ記事の「木村美濃囲いの攻略」の図の**2 つの図が一致した**(どちらも 玉2八・金3八・銀4七)。本文も「片美濃から銀を前に出した形」と述べており矛盾しない。**将棋ジムの木村美濃のページ(https://shogi-gym.com/kakoi/mino/kimuramino/)は本文の座標が後手側の段で書かれていて向きが読めなかったため、第 27 組では保留にしていた。** 向きの確かめられる図が見つかったのでここで埋めた。 **図から起こした。一次資料の確認はしていない。** 人間の決定(2026-09-25 夜、指示書 §7)により「図を人が読む工程」は入れず、このレーンが図を読む。読み方は司令塔の条件どおり: **同じ形を 2 度、違うもの(盤の図と本文の説明)で読み、一致した駒だけ**を required_pieces に入れた。図の向きは先に確かめた ― この記事の図は筋が 9→1(左→右)・段が 一→九(上→下)の**先手側**で、既に座標の分かっている本美濃(玉2八・銀3八・金5八)・片美濃・金美濃と一致することで校正した。追加の経緯: 2026-09-25 の知識レーン第 28 組(docs/LANE_KNOWLEDGE_LOG_2026-09.md §32)。",
  "confidence_level": "low",
  "review_status": "draft"
}
