{
  "id": "nakaharagakoi_opponent",
  "name": "中原囲い",
  "name_kana": "なかはらがこい",
  "side": "opponent",
  "family": "その他(相居飛車)",
  "parent_shape_id": null,
  "required_pieces": [
    {
      "piece": "玉",
      "square": "4a",
      "optional": false
    },
    {
      "piece": "金",
      "square": "5a",
      "optional": false
    },
    {
      "piece": "金",
      "square": "3b",
      "optional": false
    },
    {
      "piece": "銀",
      "square": "2b",
      "optional": false
    },
    {
      "piece": "銀",
      "square": "6b",
      "optional": false
    }
  ],
  "typical_build_order": [
    "3b",
    "5a",
    "2b",
    "6b",
    "4a"
  ],
  "characteristics": "相手がこの形に組んでいるかを読むためのレコードです。形そのものの意味は自分側の同じ名前の形(nakaharagakoi)と同じで、盤の上では 180 度回った位置に現れます。玉を6九に置き、金を5九と7八、銀を8八と4八に置いた囲いです。玉のまわりを低く広く固めた形で、横歩取り(相居飛車の激しい指し方)で使われることで知られています。中原誠十六世名人の名前がついた囲いです。",
  "beginner_friendliness": {
    "score": 2,
    "reason": "**相手の陣形を読むためのレコードで、自分が組むための評価ではありません。** 点は自分側の同じ形(nakaharagakoi)から写しただけの値です。"
  },
  "weak_against": "相手がこの形のとき、attackable な方向の目安です(断定ではありません)。玉が下段の中央寄りにいるため、駒を打ち込まれる余地が多く、上からの攻めが直接玉に届きやすいです。8八の銀と4八の銀が離れているため、片方を攻められるともう片方が守りに参加しにくいです。",
  "source": "【AI起草。座標の一次資料確認は行っていない(docs/ROLES.md の保留事項)】**自分側の同じ形 nakaharagakoi の座標を、盤ごと 180 度回して写したもの**(筋 f → 10−f、段 r → 10−r の両方を反転。写像: 玉4a・金5a・金3b・銀2b・銀6b)。**出典そのものが後手の座標を述べているわけではない**(出典は自分側のレコードの source を参照)。過去に「段だけを反転させて左右が入れ替わる」取り違えが起きているため(docs/PHASES.md の P-12、docs/STEP_UNIT6_PLAN_2026-09-12.md §9.5 の決定 3)、**写像の式をこの source に書き、4 人 70 局の実棋譜で相手の陣形として当たるかを測ってから記録した**。判定は後手視点で行われる(apps/server/src/analysis/shapeDetector.ts の perspectiveColorsForSide が side: opponent を gote に固定する)。 追加の経緯: 2026-09-25 の知識レーン第 16 組(docs/LANE_KNOWLEDGE_LOG_2026-09.md §19)。**相手側を目録の 35 件すべてまで写し切り、床(沈黙が動かなくなる点)を確かめるための最後の組**。人間の決定(2026-09-25、網羅)に沿って当たりにくい形も含めて写した。",
  "confidence_level": "medium",
  "review_status": "draft"
}
