{
  "id": "anaguma_big4_opponent",
  "name": "ビッグ4",
  "name_kana": "びっぐふぉー",
  "side": "opponent",
  "family": "穴熊系",
  "parent_shape_id": "anaguma_ibisha_opponent",
  "required_pieces": [
    {
      "piece": "玉",
      "square": "1a",
      "optional": false
    },
    {
      "piece": "香",
      "square": "1b",
      "optional": false
    },
    {
      "piece": "金",
      "square": "2b",
      "optional": false
    },
    {
      "piece": "金",
      "square": "3b",
      "optional": false
    },
    {
      "piece": "銀",
      "square": "2c",
      "optional": false
    },
    {
      "piece": "銀",
      "square": "3c",
      "optional": false
    }
  ],
  "typical_build_order": [
    "1b",
    "1a",
    "2b",
    "3b",
    "2c",
    "3c"
  ],
  "characteristics": "相手がこの形に組んでいるかを読むためのレコードです。形そのものの意味は自分側の同じ名前の形(anaguma_big4)と同じで、盤の上では 180 度回った位置に現れます。居飛車穴熊の上に銀2枚(8七・7七)を並べ、玉のふたを金2枚(8八・7八)にした、金銀4枚の穴熊です。穴熊の中でも最も固い形の一つとして知られ、上からの攻めにも横からの攻めにもとても厚い形です。",
  "beginner_friendliness": {
    "score": 1,
    "reason": "**相手の陣形を読むためのレコードで、自分が組むための評価ではありません。** 点は自分側の同じ形(anaguma_big4)から写しただけの値です。"
  },
  "weak_against": "相手がこの形のとき、attackable な方向の目安です(断定ではありません)。玉が隅に固定される穴熊共通の弱さは残り、9筋の端を攻められると玉に直接響きます。組み上がる前の速い攻めに弱く、守りに使った駒が多いぶん攻めが細くなりやすいです。",
  "source": "【AI起草。座標の一次資料確認は行っていない(docs/ROLES.md の保留事項)】**自分側の同じ形 anaguma_big4 の座標を、盤ごと 180 度回して写したもの**(筋 f → 10−f、段 r → 10−r の両方を反転。写像: 玉1a・香1b・金2b・金3b・銀2c・銀3c)。**出典そのものが後手の座標を述べているわけではない**(出典は自分側のレコードの source を参照)。過去に「段だけを反転させて左右が入れ替わる」取り違えが起きているため(docs/PHASES.md の P-12、docs/STEP_UNIT6_PLAN_2026-09-12.md §9.5 の決定 3)、**写像の式をこの source に書き、4 人 70 局の実棋譜で相手の陣形として当たるかを測ってから記録した**。判定は後手視点で行われる(apps/server/src/analysis/shapeDetector.ts の perspectiveColorsForSide が side: opponent を gote に固定する)。 追加の経緯: 2026-09-25 の知識レーン第 16 組(docs/LANE_KNOWLEDGE_LOG_2026-09.md §19)。**相手側を目録の 35 件すべてまで写し切り、床(沈黙が動かなくなる点)を確かめるための最後の組**。人間の決定(2026-09-25、網羅)に沿って当たりにくい形も含めて写した。",
  "confidence_level": "medium",
  "review_status": "draft"
}
